{
  "source_name": "Home - Welcome to the Etsy Community",
  "platform_or_regulator": "etsy.com",
  "doc_type": "guidelines",
  "url": "https://etsy.com/community-guidelines",
  "jurisdiction": "global",
  "effective_date": null,
  "version_date": "2025-08-25T00:01:16.636327",
  "topics": [],
  "sections": [
    {
      "title": "(intro)",
      "text": "Community\nTeams\nEtsy Forums Announcements Technical Issues\nAnnouncements\nTechnical Issues\nSeller Events\nSeller Handbook All Seller Handbook Articles Seller Stories Site Updates\nAll Seller Handbook Articles\nSeller Stories\nSite Updates\nHelp Help Center Technical Issues Getting Started - Teams Getting Started - Forums\nHelp Center\nTechnical Issues\nGetting Started - Teams\nGetting Started - Forums\nTeams\nEtsy Forums Announcements Technical Issues\nAnnouncements\nTechnical Issues\nSeller Events\nSeller Handbook All Seller Handbook Articles Seller Stories Site Updates\nAll Seller Handbook Articles\nSeller Stories\nSite Updates\nHelp Help Center Technical Issues Getting Started - Teams Getting Started - Forums\nHelp Center\nTechnical Issues\nGetting Started - Teams\nGetting Started - Forums",
      "anchors": []
    },
    {
      "title": "Welcome to the Etsy Community",
      "text": "Etsy sellers use these community spaces to grow their businesses. Sign in with your Etsy shop to join the conversation with thousands of other sellers. We're so glad you're here.",
      "anchors": []
    },
    {
      "title": "Etsy Up 2025: Donâ€™t miss this lineup at our 4th-ann...",
      "text": "Hi sellers!Our virtual seller event Etsy Up is back and taking place\nSeptem...",
      "anchors": []
    },
    {
      "title": "Enter the 2025 Etsy Design Awards",
      "text": "Hi! I'm Dayna Johnson Isom. As Etsy's Trend Expert, Iâ€™ve spent years\nuncove...",
      "anchors": []
    },
    {
      "title": "UPDATED 8/20 - Update on Tariffs",
      "text": "Hello Etsy Community, My name is James Ossman, and for the past year,\nI've ...",
      "anchors": []
    },
    {
      "title": "Etsy Insights: Tips for submitting to the Etsy Desi...",
      "text": "Hi everyone! Iâ€™m Dayna Isom Johnson, Etsyâ€™s Trend Expert and a returning\nju...",
      "anchors": []
    },
    {
      "title": "Peer-to-peer critiques: Your Etsy Design Awards sub...",
      "text": "Youâ€™re invited to enter the 2025 Etsy Design Awards! The Etsy Design\nAwards...",
      "anchors": []
    },
    {
      "title": "Etsy Insights: My top tips for the Etsy Design Awar...",
      "text": "Hi everyone, My name is Sarah. I am an artist, an art teacher, and the\nowne...\nLatest activity\nSolved\nTop Liked",
      "anchors": []
    },
    {
      "title": "Etsy works on one computer but not another?",
      "text": "Got a recent review that warmed your heart? Pass on the good feels by sharing your most cherished feedback with the Community.\nThe Etsy Success newsletter is packed with expert advice and the latest news from Etsy HQ.",
      "anchors": []
    },
    {
      "title": "Shop",
      "text": "Gift Cards\nEtsy Blog",
      "anchors": []
    },
    {
      "title": "Sell",
      "text": "Seller Handbook\nTeams\nForums",
      "anchors": []
    },
    {
      "title": "About",
      "text": "Etsy, Inc.\nPolicies\nCommunity Policies\nInvestors\nCareers\nPress",
      "anchors": []
    },
    {
      "title": "Follow Etsy Success",
      "text": "Facebook\nInstagram\nYouTube\nTwitter\n© 2025 Etsy, Inc.\nTerms of Use\nPrivacy\nCookies\nInterest-based ads\nLegal imprint",
      "anchors": []
    }
  ],
  "penalties": [],
  "appeals": "",
  "raw_path": "C:\\Users\\scgla\\OneDrive\\Desktop\\compliance-os\\data\\raw\\30610f31d4cab682b0478ec86eecf0d81e9bfa5a.html",
  "hash": "565dc1f8edf9587bd749b091ecb160cc69a1c34b"
}