{
  "source_name": "Our House Rules | Etsy",
  "platform_or_regulator": "etsy.com",
  "doc_type": "guidelines",
  "url": "https://etsy.com/policies",
  "jurisdiction": "global",
  "effective_date": null,
  "version_date": "2025-08-25T00:01:13.472181",
  "topics": [],
  "sections": [
    {
      "title": "Privacy Settings",
      "text": "Etsy uses cookies and similar technologies to give you a better experience, enabling things like:\nbasic site functions\nensuring secure, safe transactions\nsecure account login\nremembering account, browser, and regional preferences\nremembering privacy and security settings\nanalysing site traffic and usage\npersonalized search, content, and recommendations\nhelping sellers understand their audience\nshowing relevant, targeted ads on and off Etsy\nDetailed information can be found in Etsyâ€™s Cookies & Similar Technologies Policy and our Privacy Policy .",
      "anchors": [
        "gdpr-full-settings-overlay-title"
      ]
    },
    {
      "title": "Required Cookies & Technologies",
      "text": "Some of the technologies we use are necessary for critical functions like security and site integrity, account authentication, security and privacy preferences, internal site usage and maintenance data, and to make the site work correctly for browsing and transactions.",
      "anchors": []
    },
    {
      "title": "Personalized Advertising",
      "text": "To enable personalized advertising (like interest-based ads), we may share your data with our marketing and advertising partners using cookies and other technologies. Those partners may have their own information theyâ€™ve collected about you. Turning off the personalized advertising setting wonâ€™t stop you from seeing Etsy ads, but it may make the ads you see less relevant or more repetitive.\nPersonalized advertising may be considered a â€œsaleâ€ or â€œsharingâ€ of information under California and other state privacy laws, and you may have a right to opt out. Turning off personalized advertising allows you to exercise your right to opt out. Learn more in our Privacy Policy. , Help Center , and Cookies & Similar Technologies Policy .\nDone\nSign in\nGifts\n0 Cart\nGifts\nThe Personalization Shop\nHome Favorites\nFashion Finds\nRegistry\nGift Cards",
      "anchors": []
    },
    {
      "title": "Our House Rules",
      "text": "Get to know Etsy's legal terms and policies\nGet to know Etsy's legal terms and policies",
      "anchors": []
    },
    {
      "title": "Buyers",
      "text": "Shopping, communicating with sellers, ordering and more",
      "anchors": []
    },
    {
      "title": "Buyers",
      "text": "Shopping, communicating with sellers, ordering and more",
      "anchors": []
    },
    {
      "title": "Sellers",
      "text": "What you can sell, your responsibilities and details on fees",
      "anchors": []
    },
    {
      "title": "Sellers",
      "text": "What you can sell, your responsibilities and details on fees",
      "anchors": []
    },
    {
      "title": "Third parties",
      "text": "IP holders, API developers, affiliates and anyone requesting information",
      "anchors": []
    },
    {
      "title": "Third parties",
      "text": "IP holders, API developers, affiliates and anyone requesting information\nYes! Send me exclusive offers, unique gift ideas, and personalized tips for shopping and selling on Etsy.\nCaptcha failed to load. Try using a different browser or disabling ad blockers.",
      "anchors": []
    },
    {
      "title": "Shop",
      "text": "Gift cards\nEtsy Registry\nSitemap\nEtsy blog\nEtsy United Kingdom\nEtsy Germany\nEtsy Canada",
      "anchors": []
    },
    {
      "title": "Sell",
      "text": "Sell on Etsy\nTeams\nForums\nAffiliates & Creators",
      "anchors": []
    },
    {
      "title": "About",
      "text": "Etsy, Inc.\nPolicies\nInvestors\nCareers\nPress\nImpact",
      "anchors": []
    },
    {
      "title": "Help",
      "text": "Help Center\nPrivacy settings\nInstagram\nFacebook\nPinterest\nYoutube\nTerms of Use\nPrivacy\nInterest-based ads\nLocal Shops\nRegions Regions Etsy does business in: Australia Austria Belgium Canada Canada (French) Denmark Finland France Germany Hong Kong India Ireland Israel Italy Japan Mexico New Zealand Norway Poland Portugal Singapore Spain Sweden Switzerland The Netherlands United Kingdom United States Got it\nRegions Etsy does business in:",
      "anchors": []
    },
    {
      "title": "Update your settings",
      "text": "Set where you live, what language you speak, and the currency you use. Learn more.",
      "anchors": [
        "wt-locale-picker-overlay-title"
      ]
    }
  ],
  "penalties": [],
  "appeals": "",
  "raw_path": "C:\\Users\\scgla\\OneDrive\\Desktop\\compliance-os\\data\\raw\\648f01f7e1bb44930c659bbcd764b53db13483ba.html",
  "hash": "90b61e3e3ca63968c42d5bb2640f4611c4ab260e"
}