{
  "source_name": "TikTok",
  "platform_or_regulator": "tiktok.com",
  "doc_type": "guidelines",
  "url": "https://tiktok.com/legal/guidelines",
  "jurisdiction": "global",
  "effective_date": null,
  "version_date": "2025-08-25T00:02:35.404945",
  "topics": [],
  "sections": [
    {
      "title": "(document)",
      "text": "TikTok",
      "anchors": []
    }
  ],
  "penalties": [],
  "appeals": "",
  "raw_path": "C:\\Users\\scgla\\OneDrive\\Desktop\\compliance-os\\data\\raw\\06885139d166c0aa6b524152e2226f8ea833da47.html",
  "hash": "c6247cfc9fab65ef25428bc228c97b5434f78234"
}